{"canonicalEvidence":{"byteIdentical":true,"diskReadbackValidated":true,"run1Sha256":"694e9d033bcd45861e3a5d97df869b572f31b0929474041a980109139a1fc258","run2Sha256":"694e9d033bcd45861e3a5d97df869b572f31b0929474041a980109139a1fc258","runtimeValidated":true},"fixtureId":"ks23-postgres-e2e-v1","groundTruth":{"afterSha256":"f8ae76b899211f9350bf6560ed4f90279a4ead0c138038cfa1901201eb853ed8","beforeSha256":"f8ae76b899211f9350bf6560ed4f90279a4ead0c138038cfa1901201eb853ed8","columns":13,"constraints":9,"foreignKeys":1,"notValidatedChecks":1,"partialUniqueIndexes":1,"relations":3,"schemas":1,"unchanged":true},"image":{"manifestDigest":"sha256:94f23d40fdaf5e60cb2fd8a98c22f02a7b8724949f310d95a0ddf075e8c8b208","platform":"linux/amd64","reference":"docker.io/library/postgres@sha256:94f23d40fdaf5e60cb2fd8a98c22f02a7b8724949f310d95a0ddf075e8c8b208"},"negativeProbes":{"activeFollowers":0,"cancelSqlState":"57014","cancelState":"CANCELLED","databaseDdlSqlState":"25006","databaseMutationSqlState":"25006","mutationPolicyDispatches":0,"noPartialEvidence":true,"postProbeHealthy":true,"rawRowPolicyDispatches":0,"scopeOverrideDispatches":0,"timeoutSqlState":"57014","timeoutState":"TIMEOUT"},"nonClaims":["Local synthetic PostgreSQL 16.10 evidence only; no production, customer-data, HA, extension or version-breadth claim.","The partial unique index is fixture ground truth and an explicit query-pack blind spot, not a modeled unique constraint.","Container transport is loopback-only and intentionally does not claim production TLS behavior."],"privacy":{"credentialCanaryMatches":0,"dsnMatches":0,"outsideCanaryMatches":0,"rawRowCanaryMatches":0,"rawValueFields":0},"schemaVersion":"kaleidosphere.db/postgresql-e2e-readback/v1","session":{"adminCapabilities":false,"boundedTimeouts":true,"defaultTransactionReadOnly":"on","roleName":"ks23_scan","transactionReadOnly":"on"}}
